url,local_path,title
https://unsplash.com/s/photos/space-background?license=free,,silhouette photo of person standing
https://unsplash.com/s/photos/stars?license=free,,pink and white polka dot tote bag
https://unsplash.com/s/photos/universe?license=free,,silhouette photography of person
https://unsplash.com/s/photos/galaxy?license=free,,cluster of star illustration
https://unsplash.com/s/photos/space?license=free,,multicolored abstract painting
https://unsplash.com/s/photos/blast-off,,Two women chatting with champagne glasses in their hands with a smile
https://unsplash.com/s/photos/archival,,"1st March 1812:  Various species of lichen: inelegant hollow-shielded lichen (top), wrinkled hollow-shielded lichen (centre) and yellow candle lichen (bottom).  (Photo by Hulton Archive/Getty Images)"
https://unsplash.com/s/photos/united-states,,the statue of liberty is shown against a gray sky
https://unsplash.com/photos/space-shuttle-taking-off-n463SoeSiVY,,space shuttle taking off
https://unsplash.com/s/photos/mars,,a toy car in the middle of a desert
https://unsplash.com/photos/a-large-crater-in-the-middle-of-a-desert-E7q00J_8N7A,,a large crater in the middle of a desert
https://unsplash.com/s/photos/tech,,"3D illustration computer chip, a processor on a printed circuit board. The concept of data transfer to the cloud. Central processor in the form of artificial intelligence. Data transfer."
https://unsplash.com/s/photos/history,,"Colosseum in Rome, Italy - Long exposure shot. The Rome Colosseum was built in the time of Ancient Rome in the city center. It is the main travel destination and tourist attraction of Italy."
https://unsplash.com/s/photos/technology,,a woman sitting on a bed using a laptop
https://unsplash.com/photos/architectural-photography-of-range-hood-cIX5TlQ_FgM,,architectural photography of range hood
https://unsplash.com/s/photos/aqua,,a blue and white background with wavy lines
https://unsplash.com/photos/white-clouds-and-blue-skies-DbwYNr8RPbg,,white clouds and blue skies
https://unsplash.com/s/photos/vonore,,solar eclipse
https://unsplash.com/photos/solar-eclipse-bx4WS8mhz3w,,solar eclipse
https://unsplash.com/s/photos/current-events,,Fists rased high up. Group of protesting young people that standing together. Activist for human rights or against government.
https://unsplash.com/s/photos/night-time,,a city skyline at night with a bridge in the foreground
https://unsplash.com/s/photos/kennedy-space-center,,two chairs are in front of a large poster
https://unsplash.com/photos/timelapse-photography-of-light-PIOgkhaF3WA,,timelapse photography of light
https://unsplash.com/s/photos/super-blood-moon,,A red moon is seen over a mountain
https://unsplash.com/photos/brown-planet-QQ9MzSs-o1I,,brown planet
https://unsplash.com/s/photos/aurora-borealis,,the aurora bore is reflected in the still water of a lake
https://unsplash.com/s/photos/aurora,,a person standing on top of a snow covered slope under a sky filled with stars
https://unsplash.com/photos/northern-lights-during-night-time-R3pUGn5YiTg,,Northern lights during night time
https://unsplash.com/s/photos/map,,"wanderlust and explore concept, old compass lying on map, top view, space for text, vintage toned image"
https://unsplash.com/photos/satellite-view-of-earths-surface-_SFJhRPzJHs,,satellite view of earth's surface
https://unsplash.com/s/photos/experimental,,three glass vases with butterflies on them
https://unsplash.com/s/photos/launch,,"handmade rocket with pencils, taking off and shooting fire. 3d rendering"
https://unsplash.com/s/photos/rocket,,a red and white rocket ship flying through the sky
https://unsplash.com/photos/ray-of-light-near-body-of-water--p-KCm6xB9I,,ray of light near body of water
https://unsplash.com/s/photos/lift-off,,Two women chatting with champagne glasses in their hands with a smile
https://unsplash.com/s/photos/aerospace,,a computer generated image of a satellite dish in the desert
https://unsplash.com/s/photos/cape-canaveral-air-force-station,,a tall white building with a ladder on the side of it
https://unsplash.com/photos/photo-of-network-satellite-taking-off-yJv97tE7GDM,,photo of network satellite taking off
https://unsplash.com/s/photos/night,,Milky way over the light from the city in the distance. The vast cosmos and reflections on the universe and our place in it.
https://unsplash.com/photos/shooting-star-in-night-sky-5LOhydOtTKU,,shooting star in night sky
https://unsplash.com/photos/digital-wallpaper-of-eclipse-_ok8uVzL2gI,,digital wallpaper of eclipse
https://unsplash.com/s/photos/yosemite-valley,,a sunset view of a mountain range with pink clouds
https://unsplash.com/photos/timelapse-photography-of-warped-lines-RmoWqDCqN2E,,timelapse photography of warped lines
https://unsplash.com/s/photos/rattlesnake-lake,,a black and brown snake with its mouth open
https://unsplash.com/photos/green-leafed-tree-on-body-of-water-under-starry-sky-_WR6tUIAJe8,,green leafed tree on body of water under starry sky
https://unsplash.com/s/photos/aerial,,an aerial view of a river running through a forest
https://unsplash.com/photos/a-space-satellite-hovering-above-the-coastline-VBNb52J8Trk,,A space satellite hovering above the coastline
https://unsplash.com/s/photos/1960s,,a group of people standing next to each other
https://unsplash.com/s/photos/astronaut,,Astronaut walks under a sci fi structure with neon lights . Futuristic and innovation concept . This is a 3d render illustration .
https://unsplash.com/s/photos/nasa,,an artist's rendering of a large star cluster
https://unsplash.com/photos/astronaut-standing-on-gray-sand-e5eDHbmHprg,,astronaut standing on gray sand
https://unsplash.com/s/photos/crater,,an aerial view of a snow covered landscape
https://unsplash.com/s/photos/surface,,Woman in white bikini lying on transparent turquoise water surface on beach. Travel and vacations concept. Tropical background with empty space
https://unsplash.com/photos/photo-of-moon-surface-jlV2k_Fx0fc,,photo of moon surface
https://unsplash.com/s/photos/atmosphere,,a foggy forest with trees
https://unsplash.com/photos/satellite-flying-on-space-8Hjx3GNZYeA,,satellite flying on space
https://unsplash.com/photos/multicolored-abstract-painting-QwoNAhbmLLo,,multicolored abstract painting
https://unsplash.com/s/photos/dark?license=free,,flowing river between tall trees
https://unsplash.com/s/photos/astronaut?license=free,,astronaut standing on gray sand
https://unsplash.com/s/photos/space-stars?license=free,,stars in the sky
https://unsplash.com/s/photos/moon?license=free,,a group of red planets floating in the sky
https://unsplash.com/s/photos/planet?license=free,,Saturn and its rings
https://unsplash.com/s/photos/night-sky?license=free,,The stars and galaxy as seen from Rocky Mountain National Park.
https://unsplash.com/s/photos/star?license=free,,close up photography of moon
https://unsplash.com/s/photos/sky?license=free,,orange smoke on blue background
